{
  "schema_version": "quality-evaluation-result-1.0.0",
  "run_id": "phase13-iq4-xs-retrieval-64k-q4-20260817T060655092578Z-f1c92188",
  "timestamp": "2026-08-17T06:06:55.092578Z",
  "git_commit": "209a594671f61e6150c670e2ae2dfc4012202228",
  "classification": "phase13_iq4_xs_retrieval_64k_q4",
  "hardware_snapshot": "environment/machine-snapshot-2026-08-15.json",
  "runtime_record": "environment/phase13-mtp-quality-protocol-amendment-2026-08-16.json",
  "model_manifest": "environment/phase13-iq4-xs-download-manifest.json",
  "prompt_suite": "prompts/phase13-retrieval-64k.json",
  "quality_config": "configs/phase13-iq4-xs-retrieval-64k-q4.json",
  "python_runtime": {
    "implementation": "CPython",
    "version": "3.13.15",
    "isolated_environment": true,
    "runtime_dependencies": []
  },
  "runtime": {
    "name": "llama.cpp",
    "release_tag": "b10448",
    "commit": "ad1de39e0708e3ced9c71bb3c82d93a2c046a73f",
    "backend": "CUDA",
    "system_fingerprint": "b10448-ad1de39e0"
  },
  "model": {
    "repository": "unsloth/Qwen3.8-27B-GGUF",
    "revision": "f1bfb127c64f7072bdd2cad55f258b9c8b2910fe",
    "filename": "Qwen3.8-27B-IQ4_XS.gguf",
    "quantization": "IQ4_XS",
    "file_size_bytes": 15705861088,
    "sha256": "9fd40d7036f5e0918e20aaeebf11468fafd06bb53d4d980eef6bb7e4e4ace666",
    "served_alias": "Qwen3.8-27B-IQ4_XS"
  },
  "configuration": {
    "context_size": 65536,
    "parallel_slots": 1,
    "device": "CUDA0",
    "gpu_layers": 40,
    "fit": "off",
    "flash_attention": "on",
    "prompt_batch_size": 512,
    "prompt_micro_batch_size": 128,
    "threads": 2,
    "threads_batch": 2,
    "kv_cache_k_type": "q4_0",
    "kv_cache_v_type": "q4_0",
    "cache_ram_mib": 0,
    "context_checkpoints": 0,
    "context_shift": false,
    "thinking_mode": false,
    "preserve_thinking": false,
    "reasoning_format": "deepseek",
    "mtp_enabled": false,
    "tools_enabled": false,
    "mcp_enabled": false,
    "vision_enabled": false,
    "max_output_tokens": 32,
    "temperature": 0.0,
    "top_p": 1.0,
    "top_k": 0,
    "min_p": 0.0,
    "seed": 42,
    "prompt_cache": false
  },
  "methodology": {
    "pass_definition": "First response passes its committed deterministic validator.",
    "attempts_per_task": 1,
    "task_order_randomized": false,
    "prompt_cache_disabled": true,
    "thinking_disabled": true,
    "tools_disabled": true,
    "inter_task_delay_seconds": 0.25,
    "expected_tasks": 3
  },
  "server_preflight": {
    "status": "passed",
    "checks": {
      "health_ok": true,
      "model_alias_present": true,
      "context_size_matches": true,
      "parallel_slots_match": true,
      "model_path_matches_manifest": true
    },
    "served_model_alias": "Qwen3.8-27B-IQ4_XS"
  },
  "tasks": [
    {
      "sequence": 1,
      "task_id": "retrieval-64k-early",
      "category": "retrieval_early",
      "validator_type": "exact",
      "status": "completed",
      "passed": true,
      "grade": {
        "passed": true,
        "reason": "exact_match"
      },
      "error": null,
      "client_measurements": {
        "response_headers_ms": 36.756,
        "time_to_first_content_token_ms": 301198.138,
        "total_latency_ms": 305020.149
      },
      "finish_reason": "stop",
      "content": "TOPAZ-164",
      "reasoning_content": null,
      "usage": {
        "completion_tokens": 7,
        "prompt_tokens": 60016,
        "total_tokens": 60023,
        "prompt_tokens_details": {
          "cached_tokens": 0
        }
      },
      "timings": {
        "cache_n": 0,
        "prompt_n": 60016,
        "prompt_ms": 301161.334,
        "prompt_per_token_ms": 5.018017428685684,
        "prompt_per_second": 199.28189054973438,
        "predicted_n": 7,
        "predicted_ms": 3821.361,
        "predicted_per_token_ms": 636.8935,
        "predicted_per_second": 1.5701212212088835
      },
      "system_fingerprint": "b10448-ad1de39e0",
      "validation": {
        "request_succeeded": true,
        "content_observed": true,
        "usage_observed": true,
        "timings_observed": true,
        "prompt_cache_disabled": true,
        "reasoning_empty": true,
        "prompt_tokens_in_expected_range": true
      }
    },
    {
      "sequence": 2,
      "task_id": "retrieval-64k-middle",
      "category": "retrieval_middle",
      "validator_type": "exact",
      "status": "completed",
      "passed": true,
      "grade": {
        "passed": true,
        "reason": "exact_match"
      },
      "error": null,
      "client_measurements": {
        "response_headers_ms": 36.77,
        "time_to_first_content_token_ms": 300789.737,
        "total_latency_ms": 304602.459
      },
      "finish_reason": "stop",
      "content": "ONYX-583",
      "reasoning_content": null,
      "usage": {
        "completion_tokens": 7,
        "prompt_tokens": 60015,
        "total_tokens": 60022,
        "prompt_tokens_details": {
          "cached_tokens": 0
        }
      },
      "timings": {
        "cache_n": 0,
        "prompt_n": 60015,
        "prompt_ms": 300752.934,
        "prompt_per_token_ms": 5.011296075981005,
        "prompt_per_second": 199.54917547038792,
        "predicted_n": 7,
        "predicted_ms": 3812.139,
        "predicted_per_token_ms": 635.3565,
        "predicted_per_second": 1.5739195239208223
      },
      "system_fingerprint": "b10448-ad1de39e0",
      "validation": {
        "request_succeeded": true,
        "content_observed": true,
        "usage_observed": true,
        "timings_observed": true,
        "prompt_cache_disabled": true,
        "reasoning_empty": true,
        "prompt_tokens_in_expected_range": true
      }
    },
    {
      "sequence": 3,
      "task_id": "retrieval-64k-late",
      "category": "retrieval_late",
      "validator_type": "exact",
      "status": "completed",
      "passed": true,
      "grade": {
        "passed": true,
        "reason": "exact_match"
      },
      "error": null,
      "client_measurements": {
        "response_headers_ms": 36.228,
        "time_to_first_content_token_ms": 301082.938,
        "total_latency_ms": 305543.131
      },
      "finish_reason": "stop",
      "content": "SAFFRON-927",
      "reasoning_content": null,
      "usage": {
        "completion_tokens": 8,
        "prompt_tokens": 60015,
        "total_tokens": 60023,
        "prompt_tokens_details": {
          "cached_tokens": 0
        }
      },
      "timings": {
        "cache_n": 0,
        "prompt_n": 60015,
        "prompt_ms": 301046.709,
        "prompt_per_token_ms": 5.016191102224443,
        "prompt_per_second": 199.35444635603042,
        "predicted_n": 8,
        "predicted_ms": 4459.644,
        "predicted_per_token_ms": 637.092,
        "predicted_per_second": 1.569632015470293
      },
      "system_fingerprint": "b10448-ad1de39e0",
      "validation": {
        "request_succeeded": true,
        "content_observed": true,
        "usage_observed": true,
        "timings_observed": true,
        "prompt_cache_disabled": true,
        "reasoning_empty": true,
        "prompt_tokens_in_expected_range": true
      }
    }
  ],
  "summary": {
    "tasks_expected": 3,
    "tasks_attempted": 3,
    "requests_completed": 3,
    "tasks_passed": 3,
    "pass_rate_percent": 100.0,
    "category_results": {
      "retrieval_early": {
        "attempted": 1,
        "expected": 1,
        "passed": 1,
        "pass_rate_percent": 100.0
      },
      "retrieval_middle": {
        "attempted": 1,
        "expected": 1,
        "passed": 1,
        "pass_rate_percent": 100.0
      },
      "retrieval_late": {
        "attempted": 1,
        "expected": 1,
        "passed": 1,
        "pass_rate_percent": 100.0
      }
    },
    "finish_reason_counts": {
      "stop": 3
    },
    "all_expected_requests_completed": true
  },
  "outcome": {
    "status": "completed",
    "error_type": null,
    "error_message": null
  }
}
